{
  "specVersion": 1,
  "generatedAt": "2026-07-07T12:00:00.000Z",
  "updatedAt": "2026-07-07T12:00:00.000Z",
  "entries": [
    {
      "name": "com.example/search",
      "version": "2.0.0",
      "client": "cursor",
      "scope": "project",
      "source": {
        "registry": "https://registry.modelcontextprotocol.io",
        "id": "com.example/search"
      },
      "target": {
        "type": "remote",
        "transport": "streamable-http",
        "url": "https://mcp.example.com/v1",
        "headerSecretNames": [
          "EXAMPLE_API_KEY"
        ]
      },
      "surface": {
        "hash": "sha256-N7FpXYufkx6EkTV30ezEC5M4ITYGQErrU3F2PZDV5Is=",
        "coverage": [
          "name",
          "description",
          "inputSchema"
        ],
        "toolCount": 2,
        "capturedAt": "2026-07-07T11:59:59.000Z"
      },
      "verification": [
        {
          "code": "remote-probe",
          "status": "passed",
          "verifier": "toolpin/0.4.0",
          "method": "tools-list",
          "anchor": "mcp.example.com",
          "verifiedAt": "2026-07-07T11:59:59.000Z",
          "required": true
        },
        {
          "code": "artifact-integrity",
          "status": "unavailable"
        }
      ],
      "extensions": {
        "dev.toolpin": {
          "trust": {
            "tier": "verified",
            "score": 92
          }
        }
      },
      "configDigest": "sha256-mmi7cVjkzcOQ0i3q4dY0S3h1p9c8b7a6Z5x4W3v2U1t=",
      "resolvedAt": "2026-07-07T11:59:58.120Z",
      "lockedAt": "2026-07-07T12:00:00.000Z",
      "integrity": "sha256-GuB/eV3Lu5rVPuuePBei3cJb0iTHegJe+d5GXYeAqh8="
    }
  ],
  "extensions": {
    "dev.toolpin": {
      "source": "curated"
    }
  }
}
